{
  "$schema": "https://json-schema.org/draft/2020-12/schema",
  "$id": "urn:researchwitness:capsule:1.0",
  "title": "ResearchWitness private evidence capsule 1.0",
  "description": "Structural validation for deterministic formalization-level evidence bundles. The Python core additionally checks bytes, paths, resource bounds, anchors and arithmetic.",
  "type": "object",
  "properties": {
    "schema_version": {
      "enum": [
        "1.0"
      ]
    },
    "case_id": {
      "$ref": "#/$defs/identifier"
    },
    "artifacts": {
      "type": "object",
      "minProperties": 1,
      "maxProperties": 64,
      "additionalProperties": {
        "$ref": "#/$defs/hash"
      }
    },
    "source": {
      "type": "object",
      "properties": {
        "artifact": {
          "type": "string",
          "minLength": 1,
          "maxLength": 240
        },
        "text_artifact": {
          "type": "string",
          "minLength": 1,
          "maxLength": 240
        },
        "identifier": {
          "type": "string",
          "minLength": 1,
          "maxLength": 2000
        },
        "version": {
          "type": "string",
          "minLength": 1,
          "maxLength": 100
        },
        "capture_status": {
          "enum": [
            "unverified",
            "captured",
            "synthetic"
          ]
        },
        "correction_check": {
          "type": "object",
          "properties": {
            "checked_on": {
              "type": "string",
              "format": "date",
              "minLength": 10,
              "maxLength": 10
            },
            "status": {
              "enum": [
                "unchecked",
                "none_found",
                "present"
              ]
            },
            "evidence_artifact": {
              "type": "string",
              "minLength": 1,
              "maxLength": 240
            }
          },
          "required": [
            "checked_on",
            "status",
            "evidence_artifact"
          ],
          "additionalProperties": false
        }
      },
      "required": [
        "artifact",
        "text_artifact",
        "identifier",
        "version",
        "capture_status",
        "correction_check"
      ],
      "additionalProperties": false
    },
    "claim": {
      "type": "object",
      "properties": {
        "id": {
          "$ref": "#/$defs/identifier"
        },
        "statement": {
          "type": "string",
          "minLength": 1,
          "maxLength": 8000
        },
        "scope": {
          "type": "string",
          "minLength": 1,
          "maxLength": 4000
        },
        "assumptions": {
          "$ref": "#/$defs/strings"
        },
        "excluded_claims": {
          "$ref": "#/$defs/strings"
        },
        "anchor": {
          "type": "object",
          "properties": {
            "offset": {
              "type": "integer",
              "minimum": 0,
              "maximum": 16777216
            },
            "quote": {
              "type": "string",
              "minLength": 1,
              "maxLength": 8000
            }
          },
          "required": [
            "offset",
            "quote"
          ],
          "additionalProperties": false
        },
        "formalization": {
          "$ref": "#/$defs/formalization"
        }
      },
      "required": [
        "id",
        "statement",
        "scope",
        "assumptions",
        "excluded_claims",
        "anchor",
        "formalization"
      ],
      "additionalProperties": false
    },
    "witness_artifact": {
      "type": "string",
      "minLength": 1,
      "maxLength": 240
    },
    "unresolved_objections": {
      "type": "array",
      "items": {
        "type": "string",
        "minLength": 1,
        "maxLength": 4000
      },
      "minItems": 0,
      "maxItems": 64,
      "uniqueItems": true
    },
    "disclosure": {
      "enum": [
        "private"
      ]
    }
  },
  "required": [
    "schema_version",
    "case_id",
    "artifacts",
    "source",
    "claim",
    "witness_artifact",
    "unresolved_objections",
    "disclosure"
  ],
  "additionalProperties": false,
  "$defs": {
    "hash": {
      "type": "string",
      "pattern": "^[a-f0-9]{64}$"
    },
    "identifier": {
      "type": "string",
      "minLength": 1,
      "maxLength": 100,
      "pattern": "^[A-Za-z0-9_.-]+$"
    },
    "rational": {
      "type": "string",
      "maxLength": 130,
      "pattern": "^-?(?:0|[1-9][0-9]{0,63})(?:/[1-9][0-9]{0,63})?$"
    },
    "strings": {
      "type": "array",
      "items": {
        "type": "string",
        "minLength": 1,
        "maxLength": 4000
      },
      "minItems": 1,
      "maxItems": 64,
      "uniqueItems": true
    },
    "radical": {
      "type": "object",
      "properties": {
        "constant": {
          "$ref": "#/$defs/rational"
        },
        "terms": {
          "type": "array",
          "items": {
            "type": "object",
            "properties": {
              "coefficient": {
                "$ref": "#/$defs/rational"
              },
              "radicand": {
                "$ref": "#/$defs/rational"
              }
            },
            "required": [
              "coefficient",
              "radicand"
            ],
            "additionalProperties": false
          },
          "minItems": 0,
          "maxItems": 32
        }
      },
      "required": [
        "constant",
        "terms"
      ],
      "additionalProperties": false
    },
    "bounds": {
      "type": "object",
      "properties": {
        "lower": {
          "$ref": "#/$defs/rational"
        },
        "upper": {
          "$ref": "#/$defs/rational"
        },
        "lower_closed": {
          "type": "boolean"
        },
        "upper_closed": {
          "type": "boolean"
        }
      },
      "required": [
        "lower",
        "upper",
        "lower_closed",
        "upper_closed"
      ],
      "additionalProperties": false
    },
    "formalization": {
      "oneOf": [
        {
          "type": "object",
          "properties": {
            "kind": {
              "enum": [
                "scalar_radical_comparison"
              ]
            },
            "left": {
              "$ref": "#/$defs/radical"
            },
            "upper_bound": {
              "$ref": "#/$defs/radical"
            }
          },
          "required": [
            "kind",
            "left",
            "upper_bound"
          ],
          "additionalProperties": false
        },
        {
          "type": "object",
          "properties": {
            "kind": {
              "enum": [
                "polynomial_upper_bound"
              ]
            },
            "domain": {
              "type": "object",
              "minProperties": 1,
              "maxProperties": 8,
              "propertyNames": {
                "pattern": "^[A-Za-z_][A-Za-z0-9_]{0,23}$"
              },
              "additionalProperties": {
                "$ref": "#/$defs/bounds"
              }
            },
            "terms": {
              "type": "array",
              "items": {
                "type": "object",
                "properties": {
                  "coefficient": {
                    "$ref": "#/$defs/rational"
                  },
                  "powers": {
                    "type": "object",
                    "maxProperties": 8,
                    "additionalProperties": {
                      "type": "integer",
                      "minimum": 0,
                      "maximum": 12
                    }
                  }
                },
                "required": [
                  "coefficient",
                  "powers"
                ],
                "additionalProperties": false
              },
              "minItems": 0,
              "maxItems": 64
            },
            "upper_bound": {
              "$ref": "#/$defs/rational"
            }
          },
          "required": [
            "kind",
            "domain",
            "terms",
            "upper_bound"
          ],
          "additionalProperties": false
        },
        {
          "type": "object",
          "properties": {
            "kind": {
              "enum": [
                "uc_binary_upper_bound"
              ]
            },
            "functional": {
              "enum": [
                "uc_sqrt_penalty_v1"
              ]
            },
            "upper_bound": {
              "$ref": "#/$defs/radical"
            }
          },
          "required": [
            "kind",
            "functional",
            "upper_bound"
          ],
          "additionalProperties": false
        },
        {
          "type": "object",
          "properties": {
            "kind": {
              "enum": [
                "finite_field_polynomial_residue"
              ]
            },
            "prime": {
              "type": "integer",
              "minimum": 2,
              "maximum": 251
            },
            "variables": {
              "type": "array",
              "items": {
                "type": "string",
                "minLength": 1,
                "maxLength": 24,
                "pattern": "^[A-Za-z_][A-Za-z0-9_]*$"
              },
              "minItems": 1,
              "maxItems": 3
            },
            "parameters": {
              "type": "array",
              "items": {
                "type": "string",
                "minLength": 1,
                "maxLength": 24,
                "pattern": "^[A-Za-z_][A-Za-z0-9_]*$"
              },
              "minItems": 0,
              "maxItems": 4
            },
            "terms": {
              "type": "array",
              "items": {
                "type": "object",
                "properties": {
                  "coefficient": {
                    "type": "integer",
                    "minimum": -1000000000,
                    "maximum": 1000000000
                  },
                  "powers": {
                    "type": "object",
                    "maxProperties": 7,
                    "additionalProperties": {
                      "type": "integer",
                      "minimum": 0,
                      "maximum": 12
                    }
                  }
                },
                "required": [
                  "coefficient",
                  "powers"
                ],
                "additionalProperties": false
              },
              "minItems": 1,
              "maxItems": 64
            },
            "point_count_adjustment": {
              "type": "integer",
              "minimum": -1000,
              "maximum": 1000
            },
            "modulus": {
              "type": "integer",
              "minimum": 2,
              "maximum": 4096
            },
            "allowed_residues": {
              "type": "array",
              "items": {
                "type": "integer",
                "minimum": 0,
                "maximum": 4095
              },
              "minItems": 1,
              "maxItems": 4096
            }
          },
          "required": [
            "kind",
            "prime",
            "variables",
            "parameters",
            "terms",
            "point_count_adjustment",
            "modulus",
            "allowed_residues"
          ],
          "additionalProperties": false
        },
        {
          "type": "object",
          "properties": {
            "kind": {
              "enum": [
                "finite_field_quadratic_quartic_residue_rule"
              ]
            },
            "prime": {
              "type": "integer",
              "minimum": 2,
              "maximum": 251
            },
            "variables": {
              "type": "array",
              "items": {
                "type": "string",
                "minLength": 1,
                "maxLength": 24,
                "pattern": "^[A-Za-z_][A-Za-z0-9_]*$"
              },
              "minItems": 1,
              "maxItems": 3
            },
            "parameters": {
              "type": "array",
              "items": {
                "type": "string",
                "minLength": 1,
                "maxLength": 24,
                "pattern": "^[A-Za-z_][A-Za-z0-9_]*$"
              },
              "minItems": 0,
              "maxItems": 4
            },
            "terms": {
              "type": "array",
              "items": {
                "type": "object",
                "properties": {
                  "coefficient": {
                    "type": "integer",
                    "minimum": -1000000000,
                    "maximum": 1000000000
                  },
                  "powers": {
                    "type": "object",
                    "maxProperties": 7,
                    "additionalProperties": {
                      "type": "integer",
                      "minimum": 0,
                      "maximum": 12
                    }
                  }
                },
                "required": [
                  "coefficient",
                  "powers"
                ],
                "additionalProperties": false
              },
              "minItems": 1,
              "maxItems": 64
            },
            "point_count_adjustment": {
              "type": "integer",
              "minimum": -1000,
              "maximum": 1000
            },
            "modulus": {
              "type": "integer",
              "minimum": 2,
              "maximum": 4096
            },
            "classification_parameter": {
              "type": "string",
              "minLength": 1,
              "maxLength": 24,
              "pattern": "^[A-Za-z_][A-Za-z0-9_]*$"
            },
            "expected_residues": {
              "type": "object",
              "properties": {
                "quartic_residue": {
                  "type": "array",
                  "items": {
                    "type": "integer",
                    "minimum": 0,
                    "maximum": 4095
                  },
                  "minItems": 1,
                  "maxItems": 4096
                },
                "quadratic_nonquartic": {
                  "type": "array",
                  "items": {
                    "type": "integer",
                    "minimum": 0,
                    "maximum": 4095
                  },
                  "minItems": 1,
                  "maxItems": 4096
                },
                "quadratic_nonresidue": {
                  "type": "array",
                  "items": {
                    "type": "integer",
                    "minimum": 0,
                    "maximum": 4095
                  },
                  "minItems": 1,
                  "maxItems": 4096
                }
              },
              "required": [
                "quartic_residue",
                "quadratic_nonquartic",
                "quadratic_nonresidue"
              ],
              "additionalProperties": false
            }
          },
          "required": [
            "kind",
            "prime",
            "variables",
            "parameters",
            "terms",
            "point_count_adjustment",
            "modulus",
            "classification_parameter",
            "expected_residues"
          ],
          "additionalProperties": false
        },
        {
          "type": "object",
          "properties": {
            "kind": {
              "enum": [
                "finite_map_fixed_point"
              ]
            },
            "universe": {
              "type": "array",
              "items": {
                "type": "string",
                "minLength": 1,
                "maxLength": 100
              },
              "minItems": 1,
              "maxItems": 256
            },
            "conclusion": {
              "enum": [
                "has_fixed_point"
              ]
            }
          },
          "required": [
            "kind",
            "universe",
            "conclusion"
          ],
          "additionalProperties": false
        }
      ]
    }
  }
}
