{
  "schema_version": "1.0",
  "case_id": "synthetic-no-finding",
  "artifacts": {
    "source.txt": "62b52d02ecb6eee77ac2f6dc5669e185645e73e64483da42cd6ad4983ee043cb",
    "correction-check.txt": "f66201ed111f34f7a1e45e271a6e1ffdfbe28dd7a2d35d76e36dc857ff7ea0f7",
    "witness.json": "4f2fb46e5f62351acb20a9fb705ef764df9d05a5f7c2dd1d8f785dc50b6ac33a"
  },
  "source": {
    "artifact": "source.txt",
    "text_artifact": "source.txt",
    "identifier": "synthetic:polynomial-example",
    "version": "v1",
    "capture_status": "synthetic",
    "correction_check": {
      "checked_on": "2026-10-04",
      "status": "none_found",
      "evidence_artifact": "correction-check.txt"
    }
  },
  "claim": {
    "id": "C1",
    "statement": "For every x in [0,1], x^2 <= 1.",
    "scope": "Synthetic claim C1 in v1 only.",
    "assumptions": [
      "x is real and lies in the stated closed interval."
    ],
    "excluded_claims": [
      "This fixture is not a real paper or an independent discovery.",
      "No global optimum or paper-level error is asserted."
    ],
    "anchor": {
      "offset": 0,
      "quote": "For every x in [0,1], x^2 <= 1."
    },
    "formalization": {
      "kind": "polynomial_upper_bound",
      "domain": {
        "x": {
          "lower": "0",
          "upper": "1",
          "lower_closed": true,
          "upper_closed": true
        }
      },
      "terms": [
        {
          "coefficient": "1",
          "powers": {
            "x": 2
          }
        }
      ],
      "upper_bound": "1"
    }
  },
  "witness_artifact": "witness.json",
  "unresolved_objections": [],
  "disclosure": "private"
}
