{
  "schema_version": "1.0",
  "case_id": "synthetic-finite-field-polynomial-residue",
  "artifacts": {
    "source.txt": "dadb4d5b4a14808550c0782a94a396ec91b4940159d3b7116cb6e9558644987d",
    "correction-check.txt": "95ac4bc6184e49d10235bebac640f38aa9ffa59a77b052ba299c01efc08a7189",
    "witness.json": "e44a99e4ef4ecf7e1cb7ef3529d8efc3b6248bd2df3a2b55e7766fdfad783ad3"
  },
  "source": {
    "artifact": "source.txt",
    "text_artifact": "source.txt",
    "identifier": "synthetic:finite-field-polynomial-residue",
    "version": "v1",
    "capture_status": "synthetic",
    "correction_check": {
      "checked_on": "2026-10-04",
      "status": "none_found",
      "evidence_artifact": "correction-check.txt"
    }
  },
  "claim": {
    "id": "C1",
    "statement": "For c = 0 over F_3, the solution-count residue modulo 2 is 0.",
    "scope": "Synthetic finite-field-polynomial-residue checker fixture only.",
    "assumptions": [
      "The supplied formalization and witness are exactly the inputs shown."
    ],
    "excluded_claims": [
      "This fixture is synthetic and is not evidence about a real publication.",
      "No source-to-formalization alignment or paper-level conclusion is asserted."
    ],
    "anchor": {
      "offset": 0,
      "quote": "For c = 0 over F_3, the solution-count residue modulo 2 is 0."
    },
    "formalization": {
      "kind": "finite_field_polynomial_residue",
      "prime": 3,
      "variables": [
        "x"
      ],
      "parameters": [
        "c"
      ],
      "terms": [
        {
          "coefficient": 1,
          "powers": {
            "x": 2
          }
        },
        {
          "coefficient": -1,
          "powers": {
            "c": 1
          }
        }
      ],
      "point_count_adjustment": 0,
      "modulus": 2,
      "allowed_residues": [
        0
      ]
    }
  },
  "witness_artifact": "witness.json",
  "unresolved_objections": [],
  "disclosure": "private"
}
